{
  "schema_version": "pandamonium.extension-catalog.v1",
  "catalog_id": "pandamonium-community",
  "generated_at": "2026-09-15T23:08:11.391340+00:00",
  "expires_at": "2026-12-14T23:08:11.391340+00:00",
  "entries": [
    {
      "package_type": "plugin",
      "manifest": {
        "protocol_version": "jos-extension.v1",
        "extension_id": "ponytail",
        "name": "Ponytail",
        "version": "1.0.0",
        "source": {
          "url": "https://github.com/dietrichgebert/ponytail.git",
          "revision": "e3ba2aa6f1e6f0bc4d69eb09c9f0d0a93af56156"
        },
        "runtime": {
          "type": "skills",
          "entrypoint": ".codex-plugin/plugin.json"
        },
        "capabilities": {
          "descriptor": {
            "type": "skill_bundle",
            "format": "codex_plugin",
            "include": [
              "ponytail",
              "ponytail-audit",
              "ponytail-debt",
              "ponytail-gain",
              "ponytail-help",
              "ponytail-review"
            ]
          }
        },
        "permissions": {
          "default": "read_only",
          "capabilities": {}
        },
        "health": {
          "type": "catalog",
          "timeout_seconds": 5
        },
        "lifecycle": {
          "install": [],
          "start": [],
          "stop": [],
          "remove": []
        },
        "data_boundaries": {
          "read": [],
          "write": [],
          "network": []
        },
        "removal": {
          "remove_paths": [],
          "preserve_paths": []
        },
        "rollback": {
          "strategy": "pinned_revision",
          "retain_revisions": 1
        },
        "metadata": {
          "summary": "Lazy senior dev mode. Forces the simplest, shortest solution that actually works: YAGNI, stdlib first, no unrequested abstractions.",
          "icon": "\u2726",
          "categories": [
            "skills"
          ],
          "examples": [],
          "requirements": [],
          "skill_descriptions": {
            "ponytail": "Forces the laziest solution that actually works, simplest, shortest, most minimal. Channels a senior dev who has seen everything: question whether the task needs to exist at all (YAGNI), reach for the standard library before custom code, native platform features before dependencies, one line before fifty. Supports intensity levels: lite, full (default), ultra. Use on ANY coding task: writing, adding, refactoring, fixing, reviewing, or designing code, and choosing libraries or dependencies. Also use whenever the user says \"ponytail\", \"be lazy\", \"lazy mode\", \"simplest solution\", \"minimal solution\", \"yagni\", \"do less\", or \"shortest path\", or complains about over-engineering, bloat, boilerplate, or unnecessary dependencies. Do NOT use for non-coding requests (general knowledge, prose, translation, summaries, recipes).",
            "ponytail-audit": "Whole-repo audit for over-engineering. Like ponytail-review, but scans the entire codebase instead of a diff: a ranked list of what to delete, simplify, or replace with stdlib/native equivalents. Use when the user says \"audit this codebase\", \"audit for over-engineering\", \"what can I delete from this repo\", \"find bloat\", \"ponytail-audit\", or \"/ponytail-audit\". One-shot report, does not apply fixes.",
            "ponytail-debt": "Harvest every `ponytail:` comment in the codebase into a debt ledger, so the deliberate shortcuts and deferrals ponytail leaves behind get tracked instead of rotting into \"later means never\". Use when the user says \"ponytail debt\", \"/ponytail-debt\", \"what did ponytail defer\", \"list the shortcuts\", \"ponytail ledger\", or \"what did we mark to do later\". One-shot report, changes nothing.",
            "ponytail-gain": "Show ponytail's measured impact as a compact scoreboard: less code, less cost, more speed, from the benchmark medians. One-shot display, not a persistent mode, and not a per-repo number. Trigger: /ponytail-gain, \"ponytail gain\", \"what does ponytail save\", \"show ponytail impact\", \"ponytail scoreboard\".",
            "ponytail-help": "Quick-reference card for all ponytail modes, skills, and commands. One-shot display, not a persistent mode. Trigger: /ponytail-help, \"ponytail help\", \"what ponytail commands\", \"how do I use ponytail\".",
            "ponytail-review": "Code review focused exclusively on over-engineering. Finds what to delete: reinvented standard library, unneeded dependencies, speculative abstractions, dead flexibility. One line per finding: location, what to cut, what replaces it. Use when the user says \"review for over-engineering\", \"what can we delete\", \"is this over-engineered\", \"simplify review\", or invokes /ponytail-review. Complements correctness-focused review, this one only hunts complexity."
          }
        }
      },
      "summary": "Lazy senior dev mode. Forces the simplest, shortest solution that actually works: YAGNI, stdlib first, no unrequested abstractions.",
      "categories": [
        "skills"
      ],
      "license": "MIT",
      "publisher": {
        "id": "madpanda3d",
        "name": "MADPANDA3D",
        "url": "https://github.com/MADPANDA3D",
        "key_id": "pandamonium-marketplace-2026"
      },
      "artifact": {
        "url": "https://github.com/MADPANDA3D/Pandamonium/releases/download/plugin-ponytail-1.0.0-4866a6f578b2bca53e6d7827123ff9fb8fb223148ff6b788f54afb1121a5cb27/pandamonium-plugin-ponytail-4866a6f578b2bca53e6d7827123ff9fb8fb223148ff6b788f54afb1121a5cb27.tar.gz",
        "sha256": "4866a6f578b2bca53e6d7827123ff9fb8fb223148ff6b788f54afb1121a5cb27",
        "size_bytes": 1128757,
        "signature": {
          "algorithm": "ed25519",
          "key_id": "pandamonium-marketplace-2026",
          "value": "FjPk2M91bNocNs+F9TbV6fP5xxEltFK9byvrapOjAyjNjHtd0kffKHMgQEIEGSpz5NuuBfP+32tlvgZXWrtWDA=="
        }
      },
      "compatibility": {
        "pandamonium_min": "1.0.68",
        "pandamonium_max": "1.99.99",
        "platforms": [
          "linux"
        ],
        "architectures": [
          "amd64"
        ]
      },
      "dependencies": [],
      "configuration": [],
      "restart_required": "none",
      "review": {
        "status": "active",
        "reviewed_at": "2026-09-15T23:01:43.605389+00:00",
        "reviewer": "developer-action/isolated-validation",
        "security_advisories": []
      }
    }
  ],
  "signature": {
    "algorithm": "ed25519",
    "key_id": "pandamonium-marketplace-2026",
    "value": "N+5Lx/nziT18I38Qwqe1V/HZ/cZ4rnqewkD2s59kP79YbY0MjwWxnM/xO2F4GbUh/ZLLj44wvWo21U3XV7WgCg=="
  }
}